{
  "schema_version": "active-professional-review-evidence.v1",
  "recorded_at": "2026-08-29T22:50:17Z",
  "branch": "codex/slice-2-2-active-professional-review",
  "base_commit": "50ee7131885a371498e9b8a6dc2a5acd723afa9b",
  "governing_documents": {
    "instruction.md": "8beb45e43d2b3c0d8a7b34f0b950ecd2f8a9ceb30f805c3b8903c134142febbb",
    "architecture.md": "342a366480a0d3c2182484a338684f17a42c8d69e49abd89abfa079c96b1a93e"
  },
  "implementation": {
    "active_acceptance": "PASS",
    "append_only_supersession": "PASS",
    "professional_review_api": "PASS",
    "loopback_presentation": "PASS",
    "print_only_human_harness": "PASS"
  },
  "live_story": {
    "status": "NOT_RUN",
    "active_acceptance": "NOT_RUN",
    "supersession": "NOT_RUN",
    "professional_disposition": "NOT_RUN",
    "queue_cancellation_observation": "NOT_RUN",
    "operator_attestation": "NOT_RUN"
  },
  "verification": {
    "frozen_tests": "PASS",
    "ruff": "PASS",
    "format": "PASS",
    "mypy": "PASS",
    "lock": "PASS",
    "docker": "PASS",
    "liblouis": "PASS",
    "cups": "BLOCKED",
    "cloud_run_private_revision": "PASS"
  },
  "remaining_blockers": [
    "A fresh human-operated active-production Story 3 run has not been performed for this slice.",
    "A fresh CUPS observer authorization matrix requires an explicit human-authenticated local exercise with held and open test jobs."
  ]
}
